<?xml version="1.0" encoding="UTF-8"?>
<!-- Copyright DASSAULT SYSTEMES 2013 -->
<Config xmlns="DS_DELPPWConfiguration" xmlns:xsi="http://www.w3.org/2001/XMLSchema-instance" xsi:schemaLocation="DS_DELPPWConfiguration ../xsd/ProductFlowViewReferenceAttribute.xsd" Title="GraphView reference attributes preferences" Description="Sample configuration file delivered by DS.">
	<Preferences>
		<Node>
			<Lines>
				<Line>
					<Info property="V_Name" fontSize="20px" fontWeight="bold" color="#77797c" maxWidth="70%" />
					<Info property="revision" dicoType="BusinessType" fontSize="20px" color="#77797c" />
				</Line>
				<Line>
					<Info property="PLM_ExternalID" dicoType="DELFmiFunctionIdentifiedInstance" fontSize="12px"  color="#77797c" />
				</Line>
				<Line>
					<Info property="V_EstimatedTime" dicoType="DELLmiOperationReference" fontSize="12px" color="#b4b6ba" displayAttributeName="true" />
				</Line>
			</Lines>
			<Image value="true"/>
		</Node>
		<Link>
			<Info name="type"></Info>
		</Link>
	</Preferences>
</Config>
